The Flash Justice League DC Comics Deluxe Muscle Superhero Men Costume M,$60.99,https://i.ebayimg.com/images/g/7HIAAOSwPJ9myJIX/s-l500.webp
The Flash Barry Allen Cosplay Costume Outfits Halloween Carnival Party Suit,$61.46,https://i.ebayimg.com/images/g/rrMAAOSwcVVkwMFY/s-l500.webp
The Flash COS Server Cosplay Men's Full Head Shoes One-piece Skin-tight Garment,$147.62 to $216.26,https://i.ebayimg.com/images/g/PlgAAOSwVF1lRHuX/s-l140.webp
HOT The Flash Batman Bruce Wayne Michael Keaton Cosplay 3D Print Jumpsuit,$34.16 to $94.96,https://i.ebayimg.com/images/g/9LkAAOSwdVFmc9yf/s-l140.webp
Mens Flash Costume Classic Fancy Dress Superhero Comic DC Heroes Adults Outfit,$46.59,https://i.ebayimg.com/images/g/~LgAAOSwJkFlnAR8/s-l140.webp
The Flash 2nd Peau Costume Hommes Déguisement Adultes Superhéros,$51.35,https://i.ebayimg.com/images/g/92sAAOSwU0ZlPqIW/s-l140.webp
The Flash Adult Halloween Costume,$29.99,https://i.ebayimg.com/images/g/jHUAAOSwKeBlhG47/s-l140.webp
The Flash Movie - Muscle-Chest Batman - Adult Costume,$79.99,https://i.ebayimg.com/images/g/AmgAAOSwsFtlHcqR/s-l140.webp
Justice League Adult Deluxe Flash Costume,$76.98,https://i.ebayimg.com/images/g/AkYAAOSwpqZmuAP-/s-l140.webp
Men's Premium The Flash Classic Costume,$116.98,https://i.ebayimg.com/images/g/8KwAAOSwTwxms4Lh/s-l140.webp
The Flash Costume Injustice 2 SimCosplay Mens XL Costume,$59.99,https://i.ebayimg.com/images/g/jLYAAOSwnmRk6qtI/s-l140.webp
Flash Top Mens Costume Marvel Superhero Adults Fancy Dress Outfit,$21.16,https://i.ebayimg.com/images/g/RHMAAOSwvWNlOQ7I/s-l140.webp
The Flash Costume Tee Short Sleeve Long Sleeve Men's T-Shirt Sports Jersey,$10.98 to $14.98,https://i.ebayimg.com/images/g/ztsAAOSw5vlhPEnm/s-l140.webp
The Flash Costume Barry Allen Wally West DC Comics CW TV Show Arrowverse Movie,$137.99,https://i.ebayimg.com/images/g/34UAAOSwrYNmmoja/s-l140.webp
Adult Comic Movie FLASH Gordon Logo Red Ringer Tee Shirt Blonde Wig Costume Set,$19.95 to $21.95,https://i.ebayimg.com/images/g/~D8AAOxyD9JSCm2h/s-l140.webp
The Flash Deluxe DC Comic Movie Superhero Adult Mens Costume,$70.48,https://i.ebayimg.com/images/g/vToAAOSwZZlmpP6U/s-l140.webp
DC Justice League The Flash Muscle Chest COSTUME Halloween MENS Sz M 38/40,$28.99,https://i.ebayimg.com/images/g/eUkAAOSw29pmyQKT/s-l140.webp
Flash Hombre Disfraz Superhéroe Dc Comics con Licencia Adultos Disfraz,$39.05 to $88.73,https://i.ebayimg.com/images/g/GogAAOSwAB1lfwqV/s-l140.webp
De Luxe Flash Hommes Déguisement Justice Ligue Costume Déguisement Adultes,$53.33,https://i.ebayimg.com/images/g/bswAAOSwwlhlNSOR/s-l140.webp
The FLASH Adult Plus 2XL (48-42) Costume DC Movie Lights Up Justice League,$14.99,https://i.ebayimg.com/images/g/4lEAAOSwPE1liurP/s-l140.webp
Justice League The Flash Adult Standard Size Costume,$39.00,https://i.ebayimg.com/images/g/BioAAOSwNoVfQVuR/s-l140.webp
The Flash Mujer Disfraz Superhéroe Disfraz Sexy Halloween,$46.49,https://i.ebayimg.com/images/g/zpAAAOSwGWhlPqIa/s-l140.webp
Men's Marvel The Flash Muscle Chest Superhero Fancy Dress Costume,$52.92,https://i.ebayimg.com/images/g/N8IAAOSwFlNmUKWb/s-l140.webp
Men's Flash Classic Super Hero Costume BD DC Heroes Adult Costume,$38.85,https://i.ebayimg.com/images/g/~LgAAOSwJkFlnAR8/s-l140.webp
Mens Superheroes Superman Spiderman Batman Flash Halloween Fancy Adult Costume,$14.88,https://i.ebayimg.com/images/g/aY8AAOSwgQ9Vn8pG/s-l140.webp
Luxury Flash Costume Mens Justice League Costume Adult,$53.33,https://i.ebayimg.com/images/g/bswAAOSwwlhlNSOR/s-l140.webp
NEW The Flash Batman Bruce Wayne Michael Keaton Cosplay 3D Print Jumpsuit,$33.11 to $93.91,https://i.ebayimg.com/images/g/XDMAAOSwpVhlMMhy/s-l140.webp
Mens Flash Costume Classic Fancy Dress Superhero Comic DC Heroes Adults Outfit,$47.25,https://i.ebayimg.com/images/g/~LgAAOSwJkFlnAR8/s-l140.webp
Justice League Movie Deluxe The Flash Adult Costume Halloween Padded Mask,$34.99,https://i.ebayimg.com/images/g/liUAAOSw-RdkwVRG/s-l140.webp
"Adult Unisex DC Comics The Flash ""I Like Fast Girls"" Vintage-Inspired T-shirt",$14.99,https://i.ebayimg.com/images/g/VNwAAOSwHcxeuYoI/s-l140.webp
Mens Superheroes Superman Spiderman Batman Flash Halloween Fancy Adult Costume,$20.65,https://i.ebayimg.com/images/g/JGsAAOSwPcVVn8sd/s-l140.webp
"The Flash Muscle Chest Top with Mask, Red, Standard",$19.99,https://i.ebayimg.com/images/g/UtAAAOSwKHRjKduo/s-l140.webp
"THE FLASH SUPERHERO ADULT MENS FANCY DRESS HALLOWEEN COSTUME, STANDARD",$29.99,https://i.ebayimg.com/images/g/PI8AAOSwae5lFZUK/s-l140.webp
Ben Cooper Retro-Style Halloween Costume Tie-Side Tunic The Flash One Size #2324,$9.99,https://i.ebayimg.com/images/g/bZ0AAOSwoQBmxZLN/s-l140.webp
Il Flash 2nd Tuta IN Pelle Uomo Costume Adulti Supereroe Vestito,$51.35,https://i.ebayimg.com/images/g/92sAAOSwU0ZlPqIW/s-l140.webp
Rubies Flash Costume Men's Size Medium,$29.00,https://i.ebayimg.com/images/g/Ct0AAOSwltNdf7gi/s-l140.webp
Rubies Dc Comics “The Flash” Adult M Costume Superhero~jumpsuit & Belt Only~NEW,$12.98,https://i.ebayimg.com/images/g/y6wAAOSwGqFmycxV/s-l140.webp
Flash Top Uomo Costume Supereroe Marvel Adulti Vestito,$34.24,https://i.ebayimg.com/images/g/RHMAAOSwvWNlOQ7I/s-l140.webp
Black Lightning Bodysuit Morphsuit Size: M From The Flash,$25.99,https://i.ebayimg.com/images/g/nOQAAOSwuq9lhJnu/s-l140.webp
Mens The Flash Zentai Skinsuit Jump Suit Spandex Cosplay Costume L,$150.00,https://i.ebayimg.com/images/g/BecAAOSwXC1jTQ63/s-l140.webp
The Flash Movie Deluxe DC Superhero Fancy Dress Up Halloween Adult Costume,$67.63,https://i.ebayimg.com/images/g/X5EAAOSwKrNldfJ5/s-l140.webp
Justice League The Flash Costume Adult Mens One Size Stretchy,$25.00,https://i.ebayimg.com/images/g/B5YAAOSwk8lmZy6V/s-l140.webp
Flash Haut Hommes Déguisement Super Héro Marvel Adultes Costume Déguisement,$34.24,https://i.ebayimg.com/images/g/RHMAAOSwvWNlOQ7I/s-l140.webp
Flash Herren Kostüm Superheld Dc Comics Lizensiert Erwachsene Kostüm Outfit,$39.05 to $88.73,https://i.ebayimg.com/images/g/GogAAOSwAB1lfwqV/s-l140.webp
The Flash 2nd Skin Suit Mens Costume Adults Superhero Fancy Dress Outfit,$51.35,https://i.ebayimg.com/images/g/92sAAOSwU0ZlPqIW/s-l140.webp
The Flash Ladies Costume Superhero Fancy Dress Outfit Sexy Halloween,$54.75,https://i.ebayimg.com/images/g/zpAAAOSwGWhlPqIa/s-l140.webp
Deluxe Flash Uomo Costume Justice League Vestito Adulti,$52.95,https://i.ebayimg.com/images/g/bswAAOSwwlhlNSOR/s-l140.webp
The FLASH Adult Plus 2XL (48-42) Costume DC Movie Lights Up Justice League,$14.99,https://i.ebayimg.com/images/g/WngAAOSwXuVmt8ur/s-l140.webp
The Flash Ladies Costume Superhero Fancy Dress Outfit Sexy Halloween,$46.34,https://i.ebayimg.com/images/g/zpAAAOSwGWhlPqIa/s-l140.webp
The Flash 2nd Skin Suit Mens Costume Adults Superhero Fancy Dress Outfit,$62.02,https://i.ebayimg.com/images/g/92sAAOSwU0ZlPqIW/s-l140.webp
The Flash Mens Adult Super Hero Costume DC Comic Halloween Deluxe Muscle Chest,$60.99,https://i.ebayimg.com/images/g/ZZIAAOSwtRlbnmCo/s-l140.webp
"Rubie's Costume Co. Men's Justice League Flash Gloves One Size, As Shown",$18.66,https://i.ebayimg.com/images/g/YY4AAOSwn0VdaOah/s-l140.webp
The Flash Batman Bruce Wayne Michael Keaton Cosplay 3D Print Jumpsuit new,$33.16 to $93.96,https://i.ebayimg.com/images/g/nrAAAOSw7XFlMN2X/s-l140.webp
Flash Mens Costume Superhero DC Comics Licensed Adults Fancy Dress Outfit,$39.05 to $88.73,https://i.ebayimg.com/images/g/GogAAOSwAB1lfwqV/s-l140.webp
Flash Men's Luxury Costume Adult Licensed Superhero Costume DC Comics,$88.73,https://i.ebayimg.com/images/g/e24AAOSwX-xlOQ6j/s-l140.webp
Flash Mens Costume Superhero DC Comics Licensed Adults Fancy Dress Outfit,$25.79 to $75.42,https://i.ebayimg.com/images/g/GogAAOSwAB1lfwqV/s-l140.webp
Flashpoint Cosplay Costume Flash Barry Allen Printing Hero Jumpsuit With Mask,$49.30 to $51.21,https://i.ebayimg.com/images/g/5qYAAOSwAw9lMfIl/s-l140.webp
Flash Mens Costume Superhero DC Comics Licensed Adult Costume Outfit,$38.96 to $88.49,https://i.ebayimg.com/images/g/GogAAOSwAB1lfwqV/s-l140.webp
DC Comics The Flash Adult Halloween Costume Shirt & Mask - 40-42 XL #1247,$19.99,https://i.ebayimg.com/images/g/LxcAAOSwrQNmqd52/s-l140.webp
Tight Clothing The Flash T-shirts Tops Long Sleeves Cosplay Yellow Costumes New,$21.12,https://i.ebayimg.com/images/g/u1UAAOSwD89k9vFP/s-l140.webp
Tight Clothing The Flash T-shirts Tops Long Sleeves Cosplay Yellow Costumes New,$21.12,https://i.ebayimg.com/images/g/u1UAAOSwD89k9vFP/s-l500.webp
Flash Logo Mens Holiday Sweater,$36.98,https://i.ebayimg.com/images/g/V6oAAOSwG1Rl36yT/s-l500.webp
DC Comics The Flash Adult Halloween Costume Shirt & Mask - 40-42 XL #1247,$19.99,https://i.ebayimg.com/images/g/LxcAAOSwrQNmqd52/s-l500.webp
Vintage Flash Gordon Mens Halloween Costume Made In The USA,$65.00,https://i.ebayimg.com/images/g/CXwAAOSwrWRlbMlf/s-l500.webp
The Flash 2nd Skin Suit Mens Costume Adults Superhero Fancy Dress Outfit,$62.02,https://i.ebayimg.com/images/g/92sAAOSwU0ZlPqIW/s-l500.webp
"Rubie's Costume Co. Men's Justice League Flash Gloves One Size, As Shown",$18.66,https://i.ebayimg.com/images/g/YY4AAOSwn0VdaOah/s-l500.webp
CL489 Mens Superheroes Batman Robin Superman Flash Muscle T-Shirt Top Costume,$31.51,https://i.ebayimg.com/images/g/hwYAAOSw~gRV5uNZ/s-l500.webp
Flash Mens Costume Superhero DC Comics Licensed Adults Fancy Dress Outfit,$46.64 to $106.71,https://i.ebayimg.com/images/g/GogAAOSwAB1lfwqV/s-l500.webp
Flash Mens Costume Superhero DC Comics Licensed Adults Fancy Dress Outfit,$46.85 to $106.45,https://i.ebayimg.com/images/g/GogAAOSwAB1lfwqV/s-l500.webp
The Flash Ladies Costume Superhero Fancy Dress Outfit Sexy Halloween,$55.62,https://i.ebayimg.com/images/g/zpAAAOSwGWhlPqIa/s-l500.webp
Flash Top Men's Costume Marvel Superhero Adult Costume Outfit,$34.53,https://i.ebayimg.com/images/g/RHMAAOSwvWNlOQ7I/s-l500.webp
Flash T-Shirt Mask DC Comics Superhero Fancy Dress Up Halloween Adult Costume,$29.57,https://i.ebayimg.com/images/g/2ZAAAOSwylNl7ojK/s-l500.webp
Deluxe Flash Mens Costume Justice League Fancy Dress Outfit Adults,$53.33,https://i.ebayimg.com/images/g/bswAAOSwwlhlNSOR/s-l500.webp
"The Flash Adult Halloween Costume, Rubie's Men's Flash Deluxe Costume BRAND NEW",$49.95,https://i.ebayimg.com/images/g/EfUAAOSwHqVmZK3n/s-l500.webp
"The Flash Men's M Short Sleeve T-Shirt, Belt, Gloves & Mask Costume Set",$15.95,https://i.ebayimg.com/images/g/QFgAAOSwz5RlzDEY/s-l500.webp
The Flash 2nd Skin Suit Mens Costume Adults Superhero Fancy Dress Outfit,$61.49,https://i.ebayimg.com/images/g/92sAAOSwU0ZlPqIW/s-l500.webp
Flash Mens Costume Superhero DC Comics Licensed Adults Fancy Dress Outfit,$46.10 to $105.12,https://i.ebayimg.com/images/g/GogAAOSwAB1lfwqV/s-l500.webp
Justice League Flash Adult Plus Costume (plus Size) By Rubies,$79.41,https://i.ebayimg.com/images/g/UycAAOSwrYBf2UzV/s-l500.webp
The Flash - Movie - Muscle Chest - Deluxe Costume - Adult - 2 Sizes,$74.99,https://i.ebayimg.com/images/g/vrQAAOSweKtmgAO8/s-l500.webp
Deluxe Flash Mens Costume Justice League Fancy Dress Outfit Adults,$62.62,https://i.ebayimg.com/images/g/bswAAOSwwlhlNSOR/s-l500.webp
Deluxe Flash Mens Costume Justice League Fancy Dress Outfit Adults,$63.46,https://i.ebayimg.com/images/g/bswAAOSwwlhlNSOR/s-l500.webp
Flash Top Mens Costume Marvel Superhero Adults Fancy Dress Outfit,$40.91,https://i.ebayimg.com/images/g/RHMAAOSwvWNlOQ7I/s-l500.webp
CK37 DC Comics The Flash Muscle Chest Deluxe Toddler/Child Superhero Costume,$47.77,https://i.ebayimg.com/images/g/aNEAAOSwKtlWlu0C/s-l500.webp
NEW 2022 RETRO FLASH MASK AND TOP CLASSIC STYLE ADULT BEN COOPER Halloween Mask,$20.00,https://i.ebayimg.com/images/g/oOYAAOSwK3RlMff~/s-l500.webp
Flash de Lujo para Hombre Traje Adulto con Licencia Superhéroe Disfraz Dc Comics,$88.73,https://i.ebayimg.com/images/g/e24AAOSwX-xlOQ6j/s-l500.webp
The Flash Women Superhero Costume Costume Sexy Halloween Costume,$46.34,https://i.ebayimg.com/images/g/zpAAAOSwGWhlPqIa/s-l500.webp
Flash Top Mens Costume Marvel Superhero Adults Fancy Dress Outfit,$34.24,https://i.ebayimg.com/images/g/RHMAAOSwvWNlOQ7I/s-l500.webp
The Flash Deluxe DC Comic Movie Superhero Adult Mens Costume,$96.95,https://i.ebayimg.com/images/g/husAAOSwdn9mt3Ar/s-l500.webp
Die Flash 2nd Skin Anzug Herren Kostüm Erwachsene Superheld Kostüm Outfit,$51.35,https://i.ebayimg.com/images/g/92sAAOSwU0ZlPqIW/s-l500.webp
Flash Men's Deluxe Costume Adult Licensed Superhero Outfit DC Comics,$88.49,https://i.ebayimg.com/images/g/e24AAOSwX-xlOQ6j/s-l500.webp
Deluxe Flash Mens Costume Superhero Adults Marvel Fancy Dress Outfit,$95.68,https://i.ebayimg.com/images/g/h44AAOSw2odlNSOR/s-l500.webp
"THE FLASH SUPERHERO ADULT MENS FANCY DRESS HALLOWEEN COSTUME, XL",$34.99,https://i.ebayimg.com/images/g/NoQAAOSwuOdlFcuc/s-l500.webp
Die Flash Damen Kostüm Superheld Kostüm Outfit Sexy Halloween,$45.95,https://i.ebayimg.com/images/g/zpAAAOSwGWhlPqIa/s-l500.webp
Halloween Funny Hat Clown Costume Accessory Prop Festival Toy Miss Child Flash,$9.90,https://i.ebayimg.com/images/g/NKgAAOSwFhBmr2xu/s-l500.webp
Deluxe Flash Mens Fancy Dress Justice League Fancy Dress Outfit Adult,$53.12,https://i.ebayimg.com/images/g/bswAAOSwwlhlNSOR/s-l500.webp
DC Comics Mens Deluxe Superhero Licensed Adult Costume Dress Flash,$88.73,https://i.ebayimg.com/images/g/e24AAOSwX-xlOQ6j/s-l500.webp
The Flash Batman Bruce Wayne Michael Keaton Cosplay 3D Print Jumpsuit,$33.15 to $94.90,https://i.ebayimg.com/images/g/IoMAAOSwRy9lSgBL/s-l500.webp
The Flash 2nd Skin Suit Mens Costume Adult Superhero Costume Outfit,$51.80,https://i.ebayimg.com/images/g/92sAAOSwU0ZlPqIW/s-l500.webp
Mens Adult JUSTICE LEAGUE Muscle Chest Flash Costume XL,$39.99,https://i.ebayimg.com/images/g/rf4AAOSwz3BlFYYS/s-l500.webp
Rubies The Flash Zombie Adult Halloween Costume Size Medium,$29.99,https://i.ebayimg.com/images/g/vm8AAOSwSEVivgyF/s-l500.webp
The Flash Women's Costume Superhero Costume Outfit Sexy Halloween,$46.33,https://i.ebayimg.com/images/g/zpAAAOSwGWhlPqIa/s-l500.webp
The Flash - Adult Costume,$69.00,https://i.ebayimg.com/images/g/JzAAAOSwG0xigm-l/s-l500.webp
Herren Flash Kostüm Klassisch Kostüm Superheld Comic Dc Helden Erwachsene Outfit,$38.60,https://i.ebayimg.com/images/g/~LgAAOSwJkFlnAR8/s-l500.webp
The Black Night Zombie The Flash Deluxe Muscle Costume Adult Size XL 44-46,$59.99,https://i.ebayimg.com/images/g/pcAAAOSwDKhekc00/s-l500.webp
Zootopia Cosplay Costume DMV Officer Three-Toed Sloth Flash Outfit Set V1,$39.98,https://i.ebayimg.com/images/g/mbMAAOSw1dNaNYLI/s-l500.webp
The Flash Deluxe DC Comic Movie Superhero Adult Mens Costume,$103.16,https://i.ebayimg.com/images/g/S-IAAOSwRo5mpkvX/s-l500.webp
The Flash Batman Bruce Wayne Michael Keaton Cosplay 3D Print Jumpsuit Cosplay,$33.18 to $93.98,https://i.ebayimg.com/images/g/uSgAAOSwVJ1lS1Wt/s-l500.webp
De Luxe Flash Hommes Déguisement Superhéros Adultes Marvel Costume Déguisement,$96.94,https://i.ebayimg.com/images/g/h44AAOSw2odlNSOR/s-l500.webp
NEW 2022 REPRO FLASH PLASTIC HALF MASK CLASSIC STYLE ADULT BEN COOPER COSTUME,$15.00,https://i.ebayimg.com/images/g/uhIAAOSwYXFksOr7/s-l500.webp
Deluxe Flash Mens Costume Superhero Adults Marvel Fancy Dress Outfit,$96.14,https://i.ebayimg.com/images/g/h44AAOSw2odlNSOR/s-l500.webp
"Flash Deluxe Costume, XL Chest 44-46"" Waist 36-40"" Leg 33""",$66.16,https://i.ebayimg.com/images/g/-k4AAOSwatRbWw~z/s-l500.webp
Deluxe Muscle Chest Flash Costume,$75.69,https://secureir.ebaystatic.com/pictures/aw/pics/stockimage1.jpg
Deluxe Flash Mens Costume Superhero Adults Marvel Fancy Dress Outfit,$97.09,https://i.ebayimg.com/images/g/h44AAOSw2odlNSOR/s-l500.webp
Flash Mens Deluxe Costume Adults Licensed Superhero Fancy Dress Outfit DC Comics,$106.71,https://i.ebayimg.com/images/g/e24AAOSwX-xlOQ6j/s-l500.webp
Flash Top Hombre Disfraz Superhéroe Marvel Adultos Disfraz,$34.24,https://i.ebayimg.com/images/g/RHMAAOSwvWNlOQ7I/s-l500.webp
THE FLASH SUPERHERO ADULT MENS FANCY DRESS HALLOWEEN COSTUME,$29.99,https://i.ebayimg.com/images/g/WtYAAOSw16hlEFhY/s-l500.webp
Flash Top Mens Costume Marvel Superhero Adults Fancy Dress Outfit,$41.33,https://i.ebayimg.com/images/g/RHMAAOSwvWNlOQ7I/s-l500.webp
Flash Jay Garrick Teddy Sears Barry Allen Brown Jacket,$129.95 to $209.95,https://i.ebayimg.com/images/g/KUkAAOSwugtZv8SJ/s-l500.webp
"The Flash Men's XXL Short Sleeve T-Shirt, Belt, Gloves & Mask Costume Set",$15.95,https://i.ebayimg.com/images/g/QFgAAOSwz5RlzDEY/s-l500.webp
Men's Buzz Lightyear Costume Kit - Disguise,$33.97,https://i.ebayimg.com/images/g/kZMAAOSwciJmubcw/s-l500.webp
Deluxe Flash Mens Costume Superhero Adults Marvel Fancy Dress Outfit,$97.09,https://i.ebayimg.com/images/g/h44AAOSw2odlNSOR/s-l500.webp
Flash Barry Allen Grant Gustin Red Jacket,$129.95 to $209.95,https://i.ebayimg.com/images/g/qAoAAOSwwf5Zv8e0/s-l500.webp
"Flash Deluxe Costume, XL Chest 44-46"" Waist 36-40"" Leg 33""",$66.16,https://i.ebayimg.com/images/g/-k4AAOSwatRbWw~z/s-l500.webp
THE FLASH SUPERHERO ADULT MENS FANCY DRESS HALLOWEEN COSTUME,$29.99,https://i.ebayimg.com/images/g/WtYAAOSw16hlEFhY/s-l500.webp
Flash Top Hombre Disfraz Superhéroe Marvel Adultos Disfraz,$34.24,https://i.ebayimg.com/images/g/RHMAAOSwvWNlOQ7I/s-l500.webp
Deluxe Muscle Chest Flash Costume,$75.69,https://secureir.ebaystatic.com/pictures/aw/pics/stockimage1.jpg
The Flash Movie Shirt Mask DC Superhero Fancy Dress Up Halloween Adult Costume,$35.95,https://i.ebayimg.com/images/g/Xw0AAOSw9WxldfH5/s-l500.webp
THE FLASH Mens MUSCLE CHEST COSTUME L 42-44 NEW Jumpsuit Headpiece Belt DC Comic,$79.98,https://i.ebayimg.com/images/g/S9cAAOSwx8Bi~wLY/s-l500.webp
"The Flash Adult Halloween Costume, Rubie's Men's Flash Deluxe Costume",$51.99,https://i.ebayimg.com/images/g/yHYAAOSw1JVmMPFE/s-l500.webp
Rubie's Men's Flash Deluxe Costume Standard Size,$55.00,https://i.ebayimg.com/images/g/xNEAAOSwuqlmKDTU/s-l500.webp
Deluxe Flash Mens Costume Superhero Adults Marvel Fancy Dress Outfit,$96.14,https://i.ebayimg.com/images/g/h44AAOSw2odlNSOR/s-l500.webp
"Flash Deluxe Zombie,Mens Blackest Night Costume,Lg,CHT 42-44"",WST 34-36"",LEG 33""",$52.92,https://i.ebayimg.com/images/g/UYsAAOSwZVlXlykE/s-l500.webp
Deluxe Flash Mens Costume Superhero Adult Marvel Costume Outfit,$96.68,https://i.ebayimg.com/images/g/h44AAOSw2odlNSOR/s-l500.webp
Rubies Deluxe Flash Muscle Chest DC Comics Adult Mens Halloween Costume 888079,$34.99,https://i.ebayimg.com/images/g/28gAAOSwWStiyJrV/s-l500.webp
Flash Herren Deluxe Kostüm Erwachsene Lizenziert Superheld Outfit Dc Comics,$87.81,https://i.ebayimg.com/images/g/e24AAOSwX-xlOQ6j/s-l500.webp
DC The Flash Costume Adult Plus 2XL 48-52 Lights Up Justice League Cosplay,$37.50,https://i.ebayimg.com/images/g/m-0AAOSweBBljdxQ/s-l500.webp
FLASH T-SHIRT / D.C. COMICS ORIGINAL / SIZE M / SHARP!,$17.00,https://i.ebayimg.com/images/g/sIoAAOSwMmBVodp3/s-l500.webp
NIP Justice League The Flash Costume Adult Size Standard,$39.99,https://i.ebayimg.com/images/g/M80AAOSwkTlfE08s/s-l500.webp
The Flash Batman Bruce Wayne Michael Keaton Cosplay Costume Superhero Black,$237.41,https://i.ebayimg.com/images/g/kgIAAOSwYB5lJj~H/s-l500.webp
The Flash DC Comics CW TV Series Superhero Fancy Dress Halloween Adult Costume,$51.95,https://i.ebayimg.com/images/g/LKQAAOSwabFl7oIy/s-l500.webp
DC Comics Flash Suit Up Sublimated Tee T-Shirt,$24.95,https://i.ebayimg.com/images/g/I48AAOSwynRZvtpF/s-l500.webp
Adult Deluxe The Flash Costume,$66.98 to $86.98,https://i.ebayimg.com/images/g/2K8AAOSwZvJkv-M5/s-l500.webp
"Flash Deluxe Latex Zombie Mask, Mens Blackest Night Costume Accessory",$43.66,https://i.ebayimg.com/images/g/rVwAAOSw0RpXlynU/s-l500.webp
Deluxe Flash Mens Costume Superhero Adults Marvel Fancy Dress Outfit,$96.95,https://i.ebayimg.com/images/g/h44AAOSw2odlNSOR/s-l500.webp
RUBIES The Flash Mens Halloween Costume Size XL,$50.00,https://i.ebayimg.com/images/g/I28AAOSwpxRk~Ce1/s-l500.webp
Deluxe Flash Men's Adult Superhero Costume Marvel Dress,$96.94,https://i.ebayimg.com/images/g/h44AAOSw2odlNSOR/s-l500.webp
Flash Top Herren-Kostüm Marvel Superheld Erwachsene Kostüm Outfit,$34.24,https://i.ebayimg.com/images/g/RHMAAOSwvWNlOQ7I/s-l500.webp
The Flash 2nd Skin Suit Mens Costume Adults Superhero Fancy Dress Outfit,$61.85,https://i.ebayimg.com/images/g/92sAAOSwU0ZlPqIW/s-l500.webp
"Flash Deluxe Costume, Std Chest 44"" Waist 30-34"" Leg 33""",$66.16,https://i.ebayimg.com/images/g/a68AAOSwiq9bWw-e/s-l500.webp
Flash Mens Deluxe Costume Adults Licensed Superhero Fancy Dress Outfit DC Comics,$106.49,https://i.ebayimg.com/images/g/e24AAOSwX-xlOQ6j/s-l500.webp
"Flash Deluxe Zombie,Mens Blackest Night Costume,M,CHT 38-40"",WST 30-34"",LEG 33""",$52.92,https://i.ebayimg.com/images/g/UYsAAOSwZVlXlykE/s-l500.webp
"The Flash Men's XXL Short Sleeve T-Shirt, Belt, Gloves & Mask Costume Set",$15.95,https://i.ebayimg.com/images/g/QFgAAOSwz5RlzDEY/s-l500.webp
Flash Mens Deluxe Costume Adults Licensed Superhero Fancy Dress Outfit DC Comics,$88.73,https://i.ebayimg.com/images/g/e24AAOSwX-xlOQ6j/s-l500.webp
Flash Jay Garrick Teddy Sears Barry Allen Maroon Jacket,$89.95 to $209.95,https://i.ebayimg.com/images/g/Y4kAAOSwoF1Zv8M~/s-l500.webp
"Flash Mens Costume,X-Large, CHEST 44 - 46"", WAIST 36 - 40"", INSEAM 33""",$43.66,https://i.ebayimg.com/images/g/EicAAOSwuLZY056T/s-l500.webp
Halloween Costumes lot Masks and Nylon Fabric Capes Spiderman Flash TMNT Minion,$14.98,https://i.ebayimg.com/images/g/xUQAAOSwpbFjOj13/s-l500.webp
Flash Muscle Men Super Hero Costume DC Comics Adult XL Speedy Fancy Halloween,$49.99,https://i.ebayimg.com/images/g/qeoAAOSwLbZi~Wev/s-l500.webp
new The Flash Batman Bruce Wayne Michael Keaton Cosplay Costume Superhero Black,$237.47 to $265.97,https://i.ebayimg.com/images/g/LrQAAOSwtgJlAq0j/s-l500.webp
Trumotion The Flasher,$26.00,https://i.ebayimg.com/images/g/jngAAOSwrdBZmjPw/s-l500.webp
The Flash - Deluxe Adult Costume,$69.99,https://i.ebayimg.com/images/g/eY0AAOSwBbxlZ5dV/s-l500.webp
Deluxe Flash Herren Kostüm Superheld Erwachsene Marvel Kostüm Outfit,$96.94,https://i.ebayimg.com/images/g/h44AAOSw2odlNSOR/s-l500.webp
The Flash DC Comics Justice League Superhero Fancy Dress Halloween Adult Costume,$65.95,https://i.ebayimg.com/images/g/l~wAAOSw-ipl7oxA/s-l500.webp
Flash Justice League Superhero Fancy Dress Up Halloween Plus Size Adult Costume,$84.63,https://i.ebayimg.com/images/g/Y3IAAOSw0tVl7-gE/s-l500.webp
The Flash T-Shirt Mask DC Comics Superhero Fancy Dress Halloween Adult Costume,$35.57,https://i.ebayimg.com/images/g/DpwAAOSw-5dl7otX/s-l500.webp
Flash Mens Deluxe Costume Adults Licensed Superhero Fancy Dress Outfit DC Comics,$75.42,https://i.ebayimg.com/images/g/e24AAOSwX-xlOQ6j/s-l500.webp
The Flash DC Comics CW TV Series Superhero Fancy Dress Halloween Adult Costume,$74.63,https://i.ebayimg.com/images/g/FJAAAOSw5kll75fB/s-l500.webp
The Flash - Mask and Muscle Shirt,$35.99,https://i.ebayimg.com/images/g/DHwAAOSw75pjRasR/s-l500.webp
Flash Justice League Superhero Fancy Dress Up Halloween Deluxe Adult Costume,$79.63,https://i.ebayimg.com/images/g/5IQAAOSwVXRl7-YA/s-l500.webp
LICENSED THE FLASH TV SERIES ADULT MENS FANCY DRESS HALLOWEEN COSTUME,$42.71,https://i.ebayimg.com/images/g/UfcAAOSwpI5mz2Xp/s-l500.webp
LICENSED THE FLASH SUPERHERO ADULT MENS FANCY DRESS HALLOWEEN COSTUME,$35.25,https://i.ebayimg.com/images/g/X~EAAOSwn61mz3Ka/s-l500.webp
LICENSED SUPER HERO THE FLASH MORPH 2ND SKIN SUIT HALLOWEEN COSTUME,$50.85,https://i.ebayimg.com/images/g/9kQAAOSwiL1mzlhZ/s-l500.webp
LICENSED ADULT MENS BLACK NIGHT THE FLASH ZOMBIE FANCY DRESS HALLOWEEN COSTUME,$46.78,https://i.ebayimg.com/images/g/WB4AAOSwDVlmzlPG/s-l500.webp
LICENSED DELUXE MUSCLE CHEST THE FLASH SUPER HERO MENS ADULT FANCY DRESS COSTUME,$58.89,https://i.ebayimg.com/images/g/IeoAAOSwhKBmz23A/s-l500.webp
LICENSED FLASH ADULT SUPERHERO T-SHIRT & MASK FANCY DRESS HALLOWEEN COSTUME TOP,$32.18,https://i.ebayimg.com/images/g/oJUAAOSw6PVmz3G2/s-l500.webp
LICENSED DELUXE FLASH MUSCLE ADULT TV SERIES MENS FANCY DRESS HALLOWEEN COSTUME,$55.59,https://i.ebayimg.com/images/g/rq8AAOSwU85mz2Hy/s-l500.webp
BATMAN Flash Cosplay Adult Full Dress Professional Dress Costume Black 2023,"$1,115.53",https://i.ebayimg.com/images/g/UUEAAOSwBmBla1OU/s-l500.webp
Lujo Flash Hombre Disfraz Superhéroe Adultos Marvel Disfraz,$96.94,https://i.ebayimg.com/images/g/h44AAOSw2odlNSOR/s-l500.webp
Flash Mens Deluxe Costume Adults Licensed Superhero Fancy Dress Outfit DC Comics,$105.87,https://i.ebayimg.com/images/g/e24AAOSwX-xlOQ6j/s-l500.webp
